{
  "aspect_ratio": "9:16",
  "causal_graph_fingerprint": "sha256:b02153463863a899d5fca0836329f1d24e4b802816813b2d33bf701e84bbab93",
  "clean_room_risk_notes": [
    "No source wording, named character, branded UI, voice, music, or distinctive source sequence may be reused.",
    "This package uses only original anonymous geometry and generic props.",
    "View-count snapshots and platform guidance are not performance or virality evidence."
  ],
  "continuity_bible": {
    "forbidden_changes": [
      "no real-person likeness or brand marks",
      "do not reverse screen direction before payoff",
      "do not change prop identity between frames"
    ],
    "hero_design": "anonymous circle-headed geometric operator with consistent accent color",
    "palette": [
      "#16112A",
      "#B6A1FF",
      "#FFE078",
      "#FF758F"
    ],
    "proof_prop": "event log",
    "scene": "an automation console",
    "screen_direction": "progress moves left to right; resistance blocks the center",
    "target_prop": "restored trigger",
    "trigger_prop": "bell",
    "wardrobe": "non-identifying solid-color workwear"
  },
  "duration_ms": 6000,
  "entities": [
    {
      "entity_id": "ENT-hero",
      "initial_state": "observing trigger",
      "kind": "actor",
      "label": "a workflow owner",
      "visual_token": "hero-012"
    },
    {
      "entity_id": "ENT-trigger",
      "initial_state": "stable before hook",
      "kind": "trigger",
      "label": "bell",
      "visual_token": "bell"
    },
    {
      "entity_id": "ENT-target",
      "initial_state": "absent or unresolved",
      "kind": "target",
      "label": "restored trigger",
      "visual_token": "restored-trigger"
    },
    {
      "entity_id": "ENT-obstacle",
      "initial_state": "blocking target",
      "kind": "obstacle",
      "label": "no error appears on the main screen",
      "visual_token": "obstacle-diagnostic_mystery"
    },
    {
      "entity_id": "ENT-proof",
      "initial_state": "hidden until evidence beat",
      "kind": "proof",
      "label": "event log",
      "visual_token": "event-log"
    }
  ],
  "external_provider_state": "NOT_RUN",
  "family": "diagnostic_mystery",
  "frames": [
    {
      "a_roll_state": "full",
      "acceptance_checks": [
        "All visible and affected entity IDs are depicted consistently.",
        "The persistent target shows the declared before/action/after state.",
        "The family-specific visual operation and camera motive add the declared information."
      ],
      "affected_entity_ids": [
        "ENT-trigger"
      ],
      "audio_cue": "single inciting accent",
      "beat_role": "hook",
      "beat_roles": [
        "hook"
      ],
      "broll_function": "attention_reset",
      "camera_motion": "push_in",
      "camera_motivation": "Open a precise question with a visible changed object.",
      "cause_frame_ids": [],
      "emotion": "surprise",
      "end_ms": 1000,
      "entity_state_after": {
        "ENT-hero": "aware",
        "ENT-obstacle": "latent",
        "ENT-proof": "hidden",
        "ENT-target": "unoriented",
        "ENT-trigger": "changed"
      },
      "entity_state_before": {
        "ENT-hero": "observing",
        "ENT-obstacle": "latent",
        "ENT-proof": "hidden",
        "ENT-target": "absent",
        "ENT-trigger": "stable"
      },
      "frame_id": "ST-012-F01",
      "handback_visible": false,
      "hero_action": "notices the bell",
      "image_path": "frames/ST-012-F01.svg",
      "image_prompt": "9:16 editorial storyboard still using the `diagnostic_mystery` scene grammar. Anonymous geometric a workflow owner in an automation console. The bell changes before the objective is secure. Keep ENT-target `restored trigger` persistent and visibly transform it through `follows the last successful event`; show ENT-proof `event log` when declared. Strong mobile silhouette, no logos, no real person, no final small text.",
      "information_gain": "Open a precise question with a visible changed object.",
      "limitation_visible": false,
      "narration": "The state changed before anyone was ready.",
      "negative_prompt": "No recognizable person, no brand interface, no copyrighted character, no watermark, no illegible generated copy, no unsupported result claim.",
      "object_action": "ENT-trigger changes: ENT-target:restored trigger=absent; ENT-proof:event log=hidden → ENT-target:restored trigger=unoriented; ENT-proof:event log=hidden.",
      "on_screen_text": "SPOT THE CLUE",
      "payoff_visible": false,
      "proof_anchor_visible": false,
      "scene_change": "Family grammar `diagnostic_mystery` advances through `hook` with persistent ENT-target.",
      "screen_direction": "centered",
      "sequence_number": 1,
      "shot_scale": "macro",
      "start_ms": 0,
      "state_after": "ENT-target:restored trigger=unoriented; ENT-proof:event log=hidden",
      "state_before": "ENT-target:restored trigger=absent; ENT-proof:event log=hidden",
      "story_question": "Which clue explains the symptom?",
      "transition": "push_in motivated by open a precise question with a visible changed object.",
      "visible_entity_ids": [
        "ENT-hero",
        "ENT-trigger"
      ],
      "visual_operation": "inspect",
      "visual_state": "The bell changes before the objective is secure."
    },
    {
      "a_roll_state": "voice_over",
      "acceptance_checks": [
        "All visible and affected entity IDs are depicted consistently.",
        "The persistent target shows the declared before/action/after state.",
        "The family-specific visual operation and camera motive add the declared information."
      ],
      "affected_entity_ids": [
        "ENT-target"
      ],
      "audio_cue": "voice anchor",
      "beat_role": "orientation",
      "beat_roles": [
        "orientation"
      ],
      "broll_function": "establish_context",
      "camera_motion": "pull_out",
      "camera_motivation": "Reveal actor, target, and spatial relationship.",
      "cause_frame_ids": [
        "ST-012-F01"
      ],
      "emotion": "orientation",
      "end_ms": 2000,
      "entity_state_after": {
        "ENT-hero": "aware",
        "ENT-obstacle": "latent",
        "ENT-proof": "hidden",
        "ENT-target": "present-unresolved",
        "ENT-trigger": "changed"
      },
      "entity_state_before": {
        "ENT-hero": "aware",
        "ENT-obstacle": "latent",
        "ENT-proof": "hidden",
        "ENT-target": "unoriented",
        "ENT-trigger": "changed"
      },
      "frame_id": "ST-012-F02",
      "handback_visible": false,
      "hero_action": "locates the restored trigger",
      "image_path": "frames/ST-012-F02.svg",
      "image_prompt": "9:16 editorial storyboard still using the `diagnostic_mystery` scene grammar. Anonymous geometric a workflow owner in an automation console. The hero and persistent restored trigger share one scene; objective: find why a task stopped. Keep ENT-target `restored trigger` persistent and visibly transform it through `follows the last successful event`; show ENT-proof `event log` when declared. Strong mobile silhouette, no logos, no real person, no final small text.",
      "information_gain": "Reveal actor, target, and spatial relationship.",
      "limitation_visible": false,
      "narration": "The objective is to find why a task stopped.",
      "negative_prompt": "No recognizable person, no brand interface, no copyrighted character, no watermark, no illegible generated copy, no unsupported result claim.",
      "object_action": "ENT-target changes: ENT-target:restored trigger=unoriented; ENT-proof:event log=hidden → ENT-target:restored trigger=present-unresolved; ENT-proof:event log=hidden.",
      "on_screen_text": "LOCATE THE SYMPTOM",
      "payoff_visible": false,
      "proof_anchor_visible": false,
      "scene_change": "Family grammar `diagnostic_mystery` advances through `orientation` with persistent ENT-target.",
      "screen_direction": "centered",
      "sequence_number": 2,
      "shot_scale": "wide",
      "start_ms": 1000,
      "state_after": "ENT-target:restored trigger=present-unresolved; ENT-proof:event log=hidden",
      "state_before": "ENT-target:restored trigger=unoriented; ENT-proof:event log=hidden",
      "story_question": "Where does the symptom live?",
      "transition": "pull_out motivated by reveal actor, target, and spatial relationship.",
      "visible_entity_ids": [
        "ENT-hero",
        "ENT-trigger",
        "ENT-target"
      ],
      "visual_operation": "inspect",
      "visual_state": "The hero and persistent restored trigger share one scene; objective: find why a task stopped."
    },
    {
      "a_roll_state": "voice_over",
      "acceptance_checks": [
        "All visible and affected entity IDs are depicted consistently.",
        "The persistent target shows the declared before/action/after state.",
        "The family-specific visual operation and camera motive add the declared information."
      ],
      "affected_entity_ids": [
        "ENT-obstacle",
        "ENT-target"
      ],
      "audio_cue": "voice anchor",
      "beat_role": "obstacle",
      "beat_roles": [
        "obstacle"
      ],
      "broll_function": "concretize_abstraction",
      "camera_motion": "pan_right",
      "camera_motivation": "Make resistance and consequence inspectable.",
      "cause_frame_ids": [
        "ST-012-F02"
      ],
      "emotion": "concern",
      "end_ms": 3000,
      "entity_state_after": {
        "ENT-hero": "aware",
        "ENT-obstacle": "active",
        "ENT-proof": "hidden",
        "ENT-target": "blocked",
        "ENT-trigger": "changed"
      },
      "entity_state_before": {
        "ENT-hero": "aware",
        "ENT-obstacle": "latent",
        "ENT-proof": "hidden",
        "ENT-target": "present-unresolved",
        "ENT-trigger": "changed"
      },
      "frame_id": "ST-012-F03",
      "handback_visible": false,